{
  "page": {
    "goal": "초등 2학년 학습자가 도서관 수리 모험을 따라가며 1시간=60분, 몇 분 전 시각, 걸린 시간, 1일=24시간을 화면 조작으로 이해하게 한다.",
    "audience": "초등학교 2학년 학습자와 시간 개념을 처음 체계적으로 익히는 학생",
    "tone": "밝고 경쾌한 게임형 도서관 모험 분위기, 긴장감은 낮고 성공 피드백은 분명하게"
  },
  "art_direction": {
    "style_name": "밝은 어린이 교육용 게임 일러스트",
    "palette": "따뜻한 도서관 목재색, 노란 에너지 글로우, 민트와 하늘색 보조색, 성공 장면의 금빛 포인트를 사용하되 전체 채도는 초등 저학년에게 편안하게 유지",
    "line_style": "둥글고 명확한 형태, 중간 굵기의 부드러운 외곽선, 시계 바늘과 숫자는 크게 읽히도록 단순화",
    "lighting": "실내 도서관의 따뜻한 확산광, 문제 상황은 약간 어수선하지만 어둡지 않게, 성공과 복구 순간은 노란 글로우와 반짝임 강조",
    "character_rules": "반복 캐릭터는 꼬마 사서와 사서 선생님 두 명이다. 꼬마 사서는 작은 사서 조끼와 이름표, 밝은 표정, 갈색 단발 또는 짧은 머리, 자신감 있는 자세를 유지한다. 사서 선생님은 둥근 안경, 단정한 카디건, 돋보기 또는 책을 들 수 있으며 친절하고 당황해도 무섭지 않은 표정을 유지한다.",
    "background_rules": "마을 도서관 로비, 안내 데스크, 독서 교실 게시판, 대출 시스템 모니터가 같은 공간처럼 이어지게 만든다. 배경은 학습 UI가 올라갈 중앙 safe zone을 남기고, 책장·전광판·시계·책더미 같은 물건으로 장면성을 준다.",
    "continuity_rules": "모든 asset은 같은 도서관, 같은 캐릭터 비율, 같은 조명 방향을 공유한다. 고장 상태는 삐뚤어진 책과 빠르게 도는 시계, 복구 상태는 정돈된 책장과 정상 전광판으로 구분한다. 캐릭터 pose asset은 배경과 분리해 같은 장면 위에 반복 배치한다.",
    "forbidden_styles": [
      "실사 사진풍",
      "어두운 공포 분위기",
      "과도한 3D 렌더링",
      "flat vector UI",
      "SVG icon kit",
      "CSS component mockup",
      "복잡한 만화 컷 분할",
      "성인용 판타지 게임풍"
    ]
  },
  "sections": [
    {
      "id": "sec_intro_title",
      "title": "시간이 뒤죽박죽! 도서관 수리 미션",
      "purpose": "학습자가 이번 차시의 공간, 문제 상황, 시작 행동을 즉시 이해하게 하는 첫 화면이다.",
      "content_outline": [
        "어질러진 마을 도서관 로비를 약간 흐린 배경으로 두고 중앙에 '시간이 뒤죽박죽!'과 '수학의 힘으로 도서관 시계를 수리하라!' 제목을 크게 배치한다.",
        "하단 중앙에 노란색 시작 버튼을 두고 천천히 깜빡이는 상태로 클릭을 유도한다.",
        "시작 버튼을 누르면 밝은 시작 효과음과 함께 문제 발생 장면으로 전환한다."
      ],
      "interaction_ids": [
        "int_start_button"
      ],
      "asset_ids": [
        "asset_bg_messy_lobby"
      ]
    },
    {
      "id": "sec_problem_intro",
      "title": "고장 난 도서관 시계",
      "purpose": "도서관의 시간이 뒤죽박죽이 된 이유를 보여주고 수리 필요성을 만든다.",
      "content_outline": [
        "좌측 상단에는 햄버거 메뉴, 우측 상단에는 0% 에너지 게이지를 고정한다.",
        "도서관 중앙 벽의 대형 시계 바늘이 빠르게 도는 모습과 주변 학생들의 물음표 말풍선으로 혼란을 표현한다.",
        "사서 선생님이 대형 시계 앞에서 당황하며 '큰일 났어! 도서관 시계가 고장 나서 시간이 뒤죽박죽이야! 당장 독서 교실을 시작해야 하는데 언제인지 알 수가 없어. 누가 좀 도와주세요!'라고 말한다."
      ],
      "interaction_ids": [
        "int_hamburger_menu"
      ],
      "asset_ids": [
        "asset_bg_messy_lobby",
        "asset_teacher_worried"
      ]
    },
    {
      "id": "sec_tutorial_clock",
      "title": "꼬마 사서의 첫 수리",
      "purpose": "시계 읽기 조작을 짧은 튜토리얼로 익히고 이후 미션의 조작 문법을 소개한다.",
      "content_outline": [
        "꼬마 사서가 우측 하단에서 등장해 '걱정 마세요! 시계 보는 법을 잘 아는 제가 도와드릴게요!'라고 말한다.",
        "사서 선생님은 돋보기로 짧은바늘 3, 긴바늘 12인 작은 탁상시계를 가리키며 '이 시계가 몇 시인지 먼저 확인해 줄래?'라고 안내한다.",
        "화면 하단에 [3시], [4시], [5시] 숫자 카드를 보여주고, 학습자는 [3시] 카드를 [?] 빈칸으로 드래그한다.",
        "오답 카드는 경고음과 함께 제자리로 돌아가고, 정답은 빈칸에 고정된다."
      ],
      "interaction_ids": [
        "int_tutorial_drag_clock"
      ],
      "asset_ids": [
        "asset_bg_messy_lobby",
        "asset_child_confident",
        "asset_teacher_explaining",
        "asset_table_clock_3"
      ]
    },
    {
      "id": "sec_tutorial_success",
      "title": "첫 번째 시계 수리 성공",
      "purpose": "정답 행동의 결과를 시각적으로 강화하고 본격 문제 단계로 넘어가게 한다.",
      "content_outline": [
        "[3시]가 빈칸에 표시되면 작은 탁상시계 주변에 노란 글로우가 생기고 에너지 게이지가 10%까지 오른다.",
        "꼬마 사서는 제자리에서 만세하고, 사서 선생님은 안도하며 박수친다.",
        "사서 선생님 대사로 '와, 정답이야! 시계를 아주 잘 보는구나. 고마워, 덕분에 첫 번째 시계를 고쳤어. 이제부터 우리 도서관을 수학으로 구해줄거라 믿어!!'를 보여준다.",
        "하단에 [좋아요! 본격적으로 수리하러 가기 →] 버튼을 활성화하고 다음 단계로 이동한다."
      ],
      "interaction_ids": [
        "int_step2_transition"
      ],
      "asset_ids": [
        "asset_bg_messy_lobby",
        "asset_child_success",
        "asset_teacher_happy",
        "asset_table_clock_3"
      ]
    },
    {
      "id": "sec_mission_type_a",
      "title": "유형 A: 엉망이 된 도서관 시계 맞추기",
      "purpose": "'몇 분 전' 표현을 실제 시각과 연결해 읽는 연습을 객관식 터치로 반복한다.",
      "content_outline": [
        "공통 UI로 좌측 햄버거 메뉴, 우측 에너지 게이지, 좌측 하단 꼬마 사서 대기 모션을 유지한다.",
        "사서 선생님 말풍선으로 '전광판의 시간이 다 깨져버렸어. 몇 분 전인지 잘 읽어보고, 똑같은 시각을 가리키는 알맞은 시계를 찾아줄래?'를 제시한다.",
        "문제 1: 전광판에 [3시 5분 전]이라고 적고 보기로 2시 55분 시계, 3시 5분 시계, 3시 55분 시계를 제시한다. 정답은 2시 55분이다.",
        "문제 2: [11시 50분]을 다른 말로 읽는 보기 11시 10분 전, 12시 10분 전, 12시 50분 전을 제시한다. 정답은 12시 10분 전이다.",
        "문제 3: [8시 15분 전]을 가리키는 시계 보기 7시 45분, 8시 15분, 8시 45분을 제시한다. 정답은 7시 45분이다.",
        "문제 4: [4시 55분]의 바른 읽기 보기 4시 5분 전, 5시 5분 전, 5시 55분 전을 제시한다. 정답은 5시 5분 전이다.",
        "정답 선택 시 선택한 시계가 살짝 튀어 오르고 노란 글로우가 생기며 다음 문제로 넘어간다. 오답 선택 시 시계가 흔들리고 다시 생각해보라는 말풍선을 2초 보여준다."
      ],
      "interaction_ids": [
        "int_clock_choice_quiz",
        "int_hamburger_menu"
      ],
      "asset_ids": [
        "asset_bg_clock_counter",
        "asset_child_idle",
        "asset_teacher_explaining"
      ]
    },
    {
      "id": "sec_mission_type_b",
      "title": "유형 B: 독서 교실 시간표 복구하기",
      "purpose": "시작 시각, 끝난 시각, 걸린 시간을 연결해 계산하는 연습을 숫자 입력으로 수행한다.",
      "content_outline": [
        "문제 유형이 바뀌면 사서 선생님이 '독서 교실 시간표가 지워져서 언제 끝나는지 알 수가 없다. 시계를 보고 걸린 시간을 계산해서 빈칸을 채워줄 수 있겠니?'라고 안내한다.",
        "도서관 벽면 코르크 게시판에 문제를 표시하고, 아래에는 시작 시각 시계, 시간 이동 화살표, 빈 시계 또는 빈칸을 둔다.",
        "문제 5: 8시에 시작해서 9시에 끝난 첫 번째 독서 교실의 걸린 시간을 [1]시간으로 입력한다.",
        "문제 6: 11시 30분에 시작해서 30분 동안 진행되는 독서 교실의 끝나는 시각을 [12]시 [0]분으로 입력한다.",
        "문제 7: 오후 2시에 시작해서 1시간 동안 한 봉사활동의 끝난 시각을 보기 오후 2시 30분, 오후 3시, 오후 4시 중 고른다. 정답은 오후 3시이다.",
        "문제 8: 4시 30분부터 5시까지 책을 읽은 시간을 [30]분으로 입력한다.",
        "빈칸을 터치하면 숫자 키패드가 열리고 [확인하기]로 제출한다. 정답은 별 이펙트와 게이지 상승, 오답은 입력칸 흔들림으로 피드백한다."
      ],
      "interaction_ids": [
        "int_keypad_time_input",
        "int_clock_choice_quiz",
        "int_hamburger_menu"
      ],
      "asset_ids": [
        "asset_bg_timetable_board",
        "asset_child_idle",
        "asset_teacher_explaining"
      ]
    },
    {
      "id": "sec_mission_type_c",
      "title": "유형 C: 도서 대출 시스템 재부팅",
      "purpose": "1일과 24시간, 오전 12시간과 오후 12시간의 관계를 숫자 블록 배치로 이해하게 한다.",
      "content_outline": [
        "도서관 데스크 모니터 화면으로 전환하고 사서 선생님이 '도서 대출 시스템을 다시 켜려면 시간의 규칙을 풀어야 해! 1일과 24시간의 관계를 잘 생각해서 블록을 알맞게 넣어주렴!'이라고 말한다.",
        "모니터 안에는 오전 1~12, 오후 1~12로 나뉜 낮과 밤 타임라인을 보여준다.",
        "문제 9: 24시간은 며칠과 같은지 [1]일을 입력한다.",
        "문제 10: 하루는 오전 [?]시간과 오후 [?]시간으로 이루어진다는 문장에 [12], [12] 숫자 블록을 드래그한다.",
        "문제 11: 오늘 오후 3시에 책을 빌리고 하루가 지나면 내일 언제인지 보기 오전 3시, 오후 3시, 오후 4시 중 고른다. 정답은 오후 3시이다.",
        "문제 12: 마법 책을 1일 동안 빌릴 수 있을 때 1일은 모두 [24]시간임을 입력한다.",
        "숫자 블록이 빈칸 가까이에 가면 스냅되고, 모두 맞으면 모니터가 밝아지며 [시스템 재부팅 완료!] 메시지를 보여준다."
      ],
      "interaction_ids": [
        "int_number_block_drag",
        "int_keypad_time_input",
        "int_clock_choice_quiz",
        "int_hamburger_menu"
      ],
      "asset_ids": [
        "asset_bg_loan_system",
        "asset_child_idle",
        "asset_teacher_explaining"
      ]
    },
    {
      "id": "sec_repair_outro",
      "title": "수리 완료와 도서관 복구",
      "purpose": "12문제 해결의 성취를 보여주고 실생활 연계 단계로 넘어갈 동기를 만든다.",
      "content_outline": [
        "에너지 게이지가 90%까지 차오른 상태에서 꼬마 사서가 '해냈다! 시간의 규칙을 모두 풀었어요!'라고 말한다.",
        "사서 선생님은 '우리 수리 대원 정말 대단해! 수학 실력이 최고인걸? 이제 네가 모은 수학의 힘으로 도서관을 원래대로 되돌려보자!'라고 말한다.",
        "금빛 파티클과 마법 가루가 퍼지고, 전광판 글자와 대형 시계 바늘이 정상으로 돌아오며 바닥의 책들이 책장에 정리되는 복구 연출을 보여준다.",
        "복구가 끝나면 [3. 수리 이야기 보러 가기 →] 버튼을 활성화한다."
      ],
      "interaction_ids": [
        "int_story_transition"
      ],
      "asset_ids": [
        "asset_bg_restored_lobby",
        "asset_child_success",
        "asset_teacher_happy",
        "asset_repair_particles"
      ]
    },
    {
      "id": "sec_real_life_story",
      "title": "수리 이야기: 생활 속 시간",
      "purpose": "학습한 시간 개념이 실제 생활과 역사 속에서 쓰이는 장면을 연결한다.",
      "content_outline": [
        "깨끗하게 정리된 도서관 로비 중앙에 커다란 팝업북 또는 스마트 패드를 열고, 좌우 화살표로 3개 페이지를 넘기게 한다.",
        "페이지 1은 '24시간'이 적힌 동네 편의점 간판 장면과 함께 '1일은 24시간이기 때문에 하루 종일 쉬지 않고 문을 연다는 뜻'을 설명한다.",
        "페이지 2는 앙부일구 해시계와 그림자 장면으로, 옛날 사람들이 해의 그림자 움직임을 보고 시간을 알았음을 설명한다.",
        "페이지 3은 김이 나는 오븐과 30분 타이머 장면으로, 요리와 기다림에도 시간 계산이 필요함을 설명한다.",
        "진행도 게이지는 90% 상태로 은은하게 반짝인다."
      ],
      "interaction_ids": [
        "int_storybook_pages",
        "int_hamburger_menu"
      ],
      "asset_ids": [
        "asset_bg_restored_lobby",
        "asset_teacher_explaining",
        "asset_story_convenience_24h",
        "asset_story_sundial",
        "asset_story_oven_timer"
      ]
    },
    {
      "id": "sec_popup_quiz",
      "title": "마무리 퀴즈",
      "purpose": "1일과 24시간의 관계를 마지막으로 확인하고 에너지를 100%까지 완성한다.",
      "content_outline": [
        "갤러리를 모두 넘기면 꼬마 사서가 화면 앞으로 등장해 퀴즈 창을 띄운다.",
        "꼬마 사서가 '그럼 하루 종일 문을 여는 도서관이 있다면, 그 도서관은 며칠 동안 문을 여는 걸까요?'라고 묻는다.",
        "보기는 [1일], [1시간], [24일] 세 개이며 정답은 [1일]이다.",
        "오답은 보기 흔들림과 짧은 경고음만 제공해 다시 선택하게 한다.",
        "정답을 누르면 꼬마 사서가 '맞았어! 24시간은 1일과 같지!'라고 말하고 에너지 바가 90%에서 100%로 차오르며 황금색으로 발광한다."
      ],
      "interaction_ids": [
        "int_popup_quiz"
      ],
      "asset_ids": [
        "asset_bg_restored_lobby",
        "asset_child_success"
      ]
    },
    {
      "id": "sec_final_certificate",
      "title": "마을 수리대원 인증",
      "purpose": "학습 완료 보상을 제공하고 다음 차시인 길이 재기 학습으로 자연스럽게 연결한다.",
      "content_outline": [
        "100% 달성과 동시에 화면 전체에 팡파르와 폭죽 이펙트를 보여준다.",
        "중앙에 [마을 수리대원 인증서]를 띄우고 제목은 '마을 수리대원 인증서 (도서관 편)'으로 표시한다.",
        "인증서 내용은 '위 대원은 정확한 시간 계산으로 도서관 안내문을 완벽하게 수리하였기에 이 증서를 수여합니다.'로 구성한다.",
        "맞힌 문제 수 예시 13/13과 클리어 소요 시간을 기록 영역에 표시한다.",
        "[내 사진첩에 저장하기] 버튼과 [마을 공원 의자 만들기, 딱 맞는 길이를 찾아라! 하러 가기 →] 이동 버튼을 제공한다.",
        "사서 선생님은 '정말 고마워! 네 덕분에 도서관이 완벽해졌어!'라고 말하고, 꼬마 사서는 '언제든 제 수학실력이 필요하면 불러주세요!'라고 마무리한다."
      ],
      "interaction_ids": [
        "int_certificate_actions"
      ],
      "asset_ids": [
        "asset_bg_restored_lobby",
        "asset_child_success",
        "asset_teacher_happy",
        "asset_certificate_scene"
      ]
    }
  ],
  "interactions": [
    {
      "id": "int_start_button",
      "type": "button",
      "description": "하단 중앙 시작 버튼을 누르면 밝은 시작 효과음과 함께 타이틀 화면에서 문제 발생 장면으로 전환한다."
    },
    {